{
  "schema": "scout-research/v1",
  "round": 1,
  "focus": "アニメ／マンガのキャラクター設定を現代のラップ・フレックス世界観に移植する切り口探索。ユーザー例（ジャイアン×アルマーニ、のび太×ポルシェ）を起点に、話者・時制・対象作品・笑いの矛先の4軸で互いに異なる5案を提示する。歌詞・主題歌・原作セリフは一切収集していない（設定・関係性・現実世界の事実のみ）。",
  "angles": [
    {
      "title": "A. ガキ大将のリブランディング（成り上がった側の一人称）",
      "premise": "商店街の跡取りだった元ガキ大将が、今は仕立てのいいスーツで自分の店とレーベルを回している男として、地元の空き地跡に立って現在地を告げる曲。",
      "pov": "ジャイアン型（暴力的カリスマ）の一人称・現在形",
      "humor_type": "固有名詞の衝突＋期待の裏切り（『お前のものは俺のもの』という強奪の論理が、そのまま買収・出資・レーベル契約の語彙に翻訳されて成立してしまう可笑しさ）",
      "motifs": [
        "ジョルジオ・アルマーニのスーツ（27万〜78万円）と、若い頃に着ていたエンポリオ（12万〜30万円）の一段差",
        "実家の食料品店＝剛田商店型の家業。シャッターを上げる音、ケースの結露、レジの小銭",
        "空き地でやっていた無料の一人リサイタル → 今は箱のキャパと動員の話（だみ声は直っていない）",
        "妹（ジャイ子型）を溺愛する情の厚さ＝身内にだけ甘い経営者の顔"
      ],
      "evidence": [
        {"kind": "web", "pointer": "https://doraemon.fandom.com/ja/wiki/%E5%89%9B%E7%94%B0_%E6%AD%A6_(%E3%82%B8%E3%83%A3%E3%82%A4%E3%82%A2%E3%83%B3) ジャイアン＝剛田武の設定: 実家は剛田商店（食料品店）、妹ジャイ子、歌好きだが下手、空き地でリサイタルを開く、『おまえのものはおれのもの』の自己中心的信条"},
        {"kind": "web", "pointer": "https://fanlabo.jp/doraemon/character/takeshi-goda/ 乱暴で自己中心的だが妹を溺愛し、仲間のために体を張る情の厚さという二面性の設定"},
        {"kind": "web", "pointer": "https://www.otakaraya.jp/contents/brand/armani/armani-lineup/ アルマーニのライン構造: ジョルジオ＝最高級・イタリア職人のハンドメイド、スーツ27万〜78万円／エンポリオ＝普及ライン、スーツ12万〜30万円、20〜30代向け"},
        {"kind": "web", "pointer": "https://rude-alpha.com/hiphop/%E3%83%95%E3%83%AC%E3%83%83%E3%82%AF%E3%82%B9%E3%81%A8%E3%81%AF%EF%BC%9F%E3%83%92%E3%83%83%E3%83%97%E3%83%9B%E3%83%83%E3%83%97%E3%81%A7%E3%81%AE%E6%84%8F%E5%91%B3%E3%82%84%E6%AD%B4%E5%8F%B2%E3%80%81/ フレックス＝単なる自慢ではなく『逆境を越えてここまで来た証』として提示される文化的作法。成り上がり一人称の正当性の根拠"}
      ]
    },
    {
      "title": "B. 12年落ちのポルシェ（取り残された側の自虐フレックス）",
      "premise": "何者にもなれなかった男が、深夜のコインパーキングで、やっと手に入れた中古の空冷ではないポルシェの運転席から、自分だけの小さな勝利を数え上げる曲。",
      "pov": "のび太型（万年最下位・唯一の特技持ち）の一人称・現在形／深夜",
      "humor_type": "自虐＋スケールの落差（本物のフレックスの型を借りながら、出てくる数字だけが二桁小さい。見栄と現実の差額そのものが笑いになる）",
      "motifs": [
        "新車の911カレラは1884万〜2509万円。自分のは100万円を切った初代ボクスター（986）で、月の支払いより車検と冷却水漏れが怖い",
        "オイル交換とディーラーの見積書、コインパーキングの上限料金、屋根なし月極",
        "テストの0点と、徹夜で取った65点。一度だけ自力で取った100点の話を今もする",
        "射撃だけは百発百中という唯一の特技が、大人になるとクレーンゲームと駐車の一発切り返しにしか使えない",
        "昼寝の速さ（世界一）＝車内で寝落ちする男の落ち"
      ],
      "evidence": [
        {"kind": "web", "pointer": "https://ja.wikipedia.org/wiki/%E9%87%8E%E6%AF%94%E3%81%AE%E3%81%B3%E5%A4%AA のび太の設定: 東京都練馬区在住、勉強も運動も駄目、昼寝の早さ世界一、射撃は百発百中、あやとりの才、テスト0点常連"},
        {"kind": "web", "pointer": "https://xn--r8j5f0bvmzfu96pu1vsg3fz4l.xyz/entry3.html 射撃の腕前の具体性（早撃ち・偏差撃ち・長距離狙撃）と、徹夜で65点・一度だけ100点という数字のディテール"},
        {"kind": "web", "pointer": "https://kakaku.com/item/70101510249/ ポルシェ911カレラの日本での新車価格帯 1,884〜2,509万円（憧れの側の数字）"},
        {"kind": "web", "pointer": "https://intensive911.com/german-car-brand/porsche/197881 中古ボクスターの世代別相場: 986は100万円を切る個体がある／987後期がコスパ／981は資産価値。『やっと買えた』の現実的な着地点"},
        {"kind": "web", "pointer": "https://euro-design-osk.com/986boxster-maintenance-cost/ 986ボクスターの年間維持費の内訳（税・車検・ディーラー整備・オイル交換）。安く買えても維持で殴られる構造"}
      ]
    },
    {
      "title": "C. オールドマネーの反撃（最初から持っていた側の一人称）",
      "premise": "生まれたときから金があった男が、成り上がり組のフレックスを見下ろしながら、『お前らが去年覚えたブランドを俺は小5で飽きた』と静かにマウントを取る曲。",
      "pov": "スネ夫型（社長の息子・自慢が家業）の一人称・現在形／ラウンジか実家のガレージ",
      "humor_type": "誇張＋価値観の逆転（元祖フレックス担当が『俺こそがこのカルチャーの先輩だ』と主張し始める図々しさ。ニューマネー vs オールドマネーの本物論争をそのまま小学生の自慢の文法でやる）",
      "motifs": [
        "軽井沢の別荘、父は会社の社長、いとこ（スネ吉型）というコネクションの語彙",
        "ロレックス＝最高の実用時計／オーデマ ピゲ＝身につける高級工芸品、という『どっちを選ぶかで人種が分かる』時計観",
        "ラジコン飛行機とプラモデルの塗り分け精度＝ディテールへの偏執。ミックスの音圧やマスタリングの話に平行移動できる",
        "将来の夢はファッションデザイナー＝自分のラインを持つという現代的な着地",
        "臆病で寂しがりという裏面。仲間の輪から外れることを一番恐れている"
      ],
      "evidence": [
        {"kind": "web", "pointer": "https://dic.pixiv.net/a/%E9%AA%A8%E5%B7%9D%E3%82%B9%E3%83%8D%E5%A4%AB スネ夫の設定: 父が会社社長の裕福な家、軽井沢の別荘自慢、最新型ラジコンとプラモデルの卓越した腕、いとこスネ吉、将来の夢はファッションデザイナー、臆病で寂しがり"},
        {"kind": "web", "pointer": "https://financial-field.com/income/entry-186516 骨川家の資産規模を現実の不動産価格で見積もる記事（キャラの富を実額に翻訳する発想の先例）"},
        {"kind": "web", "pointer": "https://www.chrono24.jp/magazine/%E3%83%A9%E3%83%83%E3%83%97%E3%80%81%E3%83%92%E3%83%83%E3%83%97%E3%83%9B%E3%83%83%E3%83%97%E3%81%AB%E3%81%8A%E3%81%91%E3%82%8B%E9%AB%98%E7%B4%9A%E6%99%82%E8%A8%88-p_108740/ ヒップホップ定番の時計ブランド階層: ロレックス／オーデマ ピゲ／パテック／カルティエが第一候補、ジェイコブ&コーやリシャール・ミルが新興枠"},
        {"kind": "web", "pointer": "https://note.com/brandwatches/n/n69cd0244842c ロレックス＝最高の実用時計、AP＝身につける高級工芸品という思想の違い。『次に何を選ぶか』で階層が語られる構造"}
      ]
    },
    {
      "title": "D. 名前を出さない同窓会（作品非特定・学級カースト原型・再会の一夜）",
      "premise": "地元の駅前の店に集まった同級生たちが、あだ名でしか呼び合えないまま年収と車と子どもの話でマウントを取り合う一夜を、輪の端に座った誰かが実況する曲。",
      "pov": "作品を特定しない原型（ガキ大将／メガネ／金持ちの息子／人気者）を扱う観察者の一人称・再会の一夜",
      "humor_type": "期待の裏切り＋固有名詞の衝突（子どもの頃の序列が金の序列に上書きされているが、誰も相手の本名を思い出せない。呼び名と資産額のミスマッチが全部の落ちになる）",
      "motifs": [
        "開催前のグループLINEで既に始まっているマウント合戦（既読の数、返信の速さ、スタンプだけの奴）",
        "年収を聞いて回る男、昔の人気者が怪しい商売のリンクを送ってくる、名刺の肩書の文字数",
        "同窓会が『格差パーティー』と呼ばれる構造。住んでいる街の名前だけで勝敗がつく",
        "駅前のロータリー、二次会のカラオケ、店の外で吸う一本、帰りの終電の時刻",
        "作品を特定しないので、あだ名（ガキ大将／メガネ／社長の息子）だけで原型を走らせられる"
      ],
      "evidence": [
        {"kind": "web", "pointer": "https://nikkan-spa.jp/1544947 アラサー同窓会でスクールカーストが逆転する現象を扱った記事。学校内序列と大人の序列のズレという枠組み"},
        {"kind": "web", "pointer": "https://gentosha-go.com/articles/-/68074 同窓会開催前のグループLINEで始まるマウント合戦という具体的な現代シーン"},
        {"kind": "web", "pointer": "https://joshi-spa.jp/872213 同窓会で年収を聞いて回る参加者、昔の人気者が怪しい商売に流れているというあるある"},
        {"kind": "web", "pointer": "https://xn--4gq9qg56gyebu80ebpb.com/dousoukai-gap/ 同窓会が『格差パーティー』と呼ばれ、職業・年収・住む場所で格差が可視化されるという整理"},
        {"kind": "web", "pointer": "https://rude-alpha.com/hiphop/%E3%83%AC%E3%83%9A%E3%82%BC%E3%83%B3%E3%81%AE%E6%84%8F%E5%91%B3%E3%81%A8%E3%81%AF%EF%BC%9F%E8%AA%9E%E6%BA%90%E3%83%BB%E4%BD%BF%E3%81%84%E6%96%B9%E3%83%BB%E7%8F%BE%E4%BB%A3%E3%81%A7%E3%81%AE%E4%BD%BF/ レペゼン＝出身地・ルーツを代表し誇る作法。『地元に帰る夜』をラップの正規の型として使える根拠"}
      ]
    },
    {
      "title": "E. 貸与品の視点（所有される側＝道具・機械・車が語る）",
      "premise": "買われた側・借りられた側の物（ポンコツの旧型ロボット、あるいは名義がローン会社のままの車）が、自分を持ち主として自慢する人間たちを棚の上から採点する曲。",
      "pov": "道具／機械そのものの一人称・現在形（人間は三人称でしか出てこない）",
      "humor_type": "視点の異化＋自虐（フレックスされる側がフレックスし返す。所有者の見栄を、型番と故障率という即物的な数字で切り返す）",
      "motifs": [
        "129.3という反復する数字（身長cm・体重kg・馬力）と、量産型の型番・シリアル・保証期間",
        "ネズミにかじられて欠けた部品と、それ以来直していない箇所。中古で来た個体という出自",
        "土管の積まれた空き地＝昭和40年代の下水道工事の資材置き場。今は資材の放置が規制されて消えた風景＝『あの遊び場はもう物理的に存在しない』",
        "名義はローン会社、支払いはあと何回、残価設定の最終回。所有しているつもりの人間との温度差",
        "夜のガレージの音（電源が落ちる音、冷却ファン、シャッター）"
      ],
      "evidence": [
        {"kind": "web", "pointer": "https://ja.wikipedia.org/wiki/%E3%83%89%E3%83%A9%E3%81%88%E3%82%82%E3%82%93_(%E3%82%AD%E3%83%A3%E3%83%A9%E3%82%AF%E3%82%BF%E3%83%BC) ネコ型ロボットの設定: 身長129.3cm・体重129.3kg・パワー129.3馬力、猫耳を失っている、量産型ロボットという位置づけ"},
        {"kind": "web", "pointer": "http://legend-anime.com/archives/69 耳をネズミにかじられて失ったという経緯の設定（体色変化については原作で描かれていないという注釈つき）"},
        {"kind": "web", "pointer": "https://www.bookbang.jp/article/754280 空き地に土管が積まれていた理由＝昭和40年代の下水道工事全盛期の資材ストック。風景が現実の工事事情に由来するという事実"},
        {"kind": "web", "pointer": "https://sh-manga-anime.hatenablog.com/entry/doraemon_17 空き地の筒はヒューム管（コンクリート製）であり土管（粘土焼成）とは別物という区別。安全基準の強化で資材放置が規制され現在は見かけない"},
        {"kind": "web", "pointer": "https://www.nextage.jp/gaisya_guide/recommend/226601/ ポルシェの年間維持費が高額になる理由の内訳。『持っている』と『払い続けている』の差を数字で書ける根拠"}
      ]
    }
  ],
  "warnings": [
    "歌詞・主題歌・原作セリフの文言は一切収集していない。収集したのはキャラクター設定（性格・家族構成・特技・所持品）と、現実世界の価格・慣習・用語のみ。",
    "キャラクター設定の出典にはファン運営のwiki（Fandom / ピクシブ百科事典 / 個人ブログ）が含まれるため、細部（誕生日・学年・数値）の一次情報としての確度は中程度。リリックに数字を書く場合は要再確認。",
    "ポルシェ・アルマーニの価格帯は2025〜2026年時点の日本の一般記事ベースの目安であり、グレード・年式・為替で変動する。歌詞では『概ねこの桁』の解像度で使うのが安全。",
    "中古986ボクスターの維持費に関する検索要約には桁の誤り（税金が年『7.7〜8.6万円』であるべき箇所など）が含まれていた。実額を歌詞に入れる場合は原文の再確認が必須。",
    "案A〜C・EはドラえもんのキャラクターIPを直接想起させるため、実際の商品化では固有名を出さず原型（ガキ大将／万年最下位／社長の息子／旧型ロボット）で書く選択肢を残すこと。案Dは最初から作品非特定として設計してある。",
    "ユーザーが提供していない実話・経歴は一切含めていない。全案は fictional の設定・連想素材である。"
  ]
}
